{
    "$schema": "http://json-schema.org/draft-07/schema#",
    "$id": "https://nwfp.rothamsted.ac.uk/schema/NwfpCatchment.json",
    "title": "NWFP Catchment",
    "description": "Describes a catchment from the North Wyke Farm Platform.",
    "type": "object",
    "properties": {
        "catchmentId": {
            "description": "The unique identifier for a catchment",
            "type": "integer" 
        }, 
        "displayName": {
            "description":"The display name for the catchment",
            "type":"string"
        },
        "farmlet": {
            "description":"The farmlet the catchment belongs to",
            "$ref":"https://nwfp.rothamsted.ac.uk/schema/NwfpFarmlet.json"
        },
        "boundary": {
            "description": "The boundary of the farmlet",
            "anyOf": [
                {
                  "$ref": "http://geojson.org/schema/MultiPolygon.json"
                },
                {
                  "$ref": "https://geojson.org/schema/Polygon.json"
                }
            ]            
        },
        "fields": {
            "description": "The fields belonging to the catchment",
            "type": "array",
            "minItems": 1,
            "uniqueItems": true,
            "items": {
                "$ref":"https://nwfp.rothamsted.ac.uk/schema/NwfpField.json"            
            }
        },
        "instruments": {
            "description":"Instruments associated with the whole catchment",
            "type": "array",
            "minItems": 0,
            "uniqueItems": true,
            "items": {
                "$ref":"https://nwfp.rothamsted.ac.uk/schema/NwfpInstrument.json"
            }
        }
    }
}