{
    "catchmentId":1,
    "displayName":"Catchment 1",
    "farmlet":{
        "farmletId":2,
        "displayName":"Red Farmlet",
        "boundary": {
            "type": "Polygon",
            "coordinates": [
                [
                    [100.0, 0.0], [101.0, 0.0], [101.0, 1.0], [100.0, 1.0],
                    [100.0, 0.0]
                ]
            ]
        }
    },
    "fields": [
        {
            "fieldId":10,
            "farmletId":2,
            "displayName":"field 10"
        },
        {
            "fieldId":11,
            "farmletId":2,
            "displayName":"field 11"
        }
    ]
}